{"Ajax": [4, "/categories/ajax.html", {"posts": [{"date": "08/13/2015", "isodate": "2015-08-13T00:00:00-07:00", "title": "Possible Ajax Error Code and Reasons", "url": "/posts/2015/JavaScript/possible-ajax-error-code-and-reasons.html"}, {"date": "08/05/2015", "isodate": "2015-08-05T00:00:00-07:00", "title": "RequestDispacher and Redirection in Java Web App", "url": "/posts/2015/Java/requestdispacher-redirection-in-java.html"}, {"date": "08/03/2015", "isodate": "2015-08-03T00:00:00-07:00", "title": "Ajax and Java Servlet", "url": "/posts/2015/Java/ajax-and-java-servlet.html"}, {"date": "01/13/2015", "isodate": "2015-01-13T00:00:00-08:00", "title": "Ajax and Spring MVC Controller", "url": "/posts/2015/Java/ajax-and-spring-mvc-controller.html"}]}], "Algorithm": [5, "/categories/algorithm.html", {"posts": [{"date": "07/05/2016", "isodate": "2016-07-05T00:00:00-07:00", "title": "Reading Note - Algorithm Analysis", "url": "/posts/2016/Algorithm/reading-note-algorithm-analysis.html"}, {"date": "09/11/2015", "isodate": "2015-09-11T00:00:00-07:00", "title": "Algorithm and Data Structure Basics - Sorting", "url": "/posts/2015/Algorithm%20Data%20Structure/algorithm-and-data-structure-basics-sorting.html"}, {"date": "09/03/2015", "isodate": "2015-09-03T00:00:00-07:00", "title": "Algorithm and Data Structure Basics - Heap", "url": "/posts/2015/Algorithm%20Data%20Structure/algorithm-and-data-structure-basics-heap.html"}, {"date": "09/02/2015", "isodate": "2015-09-02T00:00:00-07:00", "title": "Algorithm and Data Structure Basics - Recursion", "url": "/posts/2015/Algorithm%20Data%20Structure/algorithm-and-data-structure-basics-recursion.html"}, {"date": "09/02/2015", "isodate": "2015-09-02T00:00:00-07:00", "title": "Algorithm and Data Structure Basics - Linked List", "url": "/posts/2015/Algorithm%20Data%20Structure/algorithm-and-data-structure-basics-linkedlist.html"}, {"date": "09/01/2015", "isodate": "2015-09-01T00:00:00-07:00", "title": "Algorithm and Data Structure Basics - Dynamic Programming", "url": "/posts/2015/Algorithm%20Data%20Structure/algorithm-and-data-structure-basics-dynamic-programming.html"}]}], "Amazon EC2": [1, "/categories/amazon-ec2.html", {"posts": [{"date": "01/13/2015", "isodate": "2015-01-13T00:00:00-08:00", "title": "Use Amazon EC2 to Host IPython Notebook", "url": "/posts/2015/Data%20Science/use-amazon-ec2-to-host-ipython-notebook.html"}]}], "Android": [1, "/categories/android.html", {"posts": [{"date": "01/13/2015", "isodate": "2015-01-13T00:00:00-08:00", "title": "Reading Note for Andorid Development Guide Part I", "url": "/posts/2014/reading-note-android-I.html"}]}], "AngularJS": [1, "/categories/angularjs.html", {"posts": [{"date": "08/16/2016", "isodate": "2016-08-16T00:00:00-07:00", "title": "AngularJS 2 Study Note (Continually Update)", "url": "/posts/2016/JavaScript/angularjs-2-study-note.html"}, {"date": "08/11/2015", "isodate": "2015-08-11T00:00:00-07:00", "title": "AngularJS Basics", "url": "/posts/2015/JavaScript/angularjs-basics.html"}]}], "Big Data": [1, "/categories/big-data.html", {"posts": [{"date": "08/10/2015", "isodate": "2015-08-10T00:00:00-07:00", "title": "SparkSQL Basics", "url": "/posts/2015/Data%20Science/sparksql-basics.html"}]}], "Bootstrap3": [5, "/categories/bootstrap3.html", {"posts": [{"date": "07/09/2015", "isodate": "2015-07-09T00:00:00-07:00", "title": "Bootstrap 3 Sticky Footer by Martin Bean and Ryan Fait", "url": "/posts/2015/Front%20End/bootstrap3_sticky_footer.html"}, {"date": "06/04/2015", "isodate": "2015-06-04T00:00:00-07:00", "title": "Collection of Tips for Creating/Controlling Dropdown on Web Page", "url": "/posts/2015/JavaScript/create-controll-dropdown.html"}, {"date": "01/13/2015", "isodate": "2015-01-13T00:00:00-08:00", "title": "JavaScript Library Experience: FullCalendar", "url": "/posts/2015/JavaScript/javascript-library-experience-fullcalendar.html"}, {"date": "12/10/2014", "isodate": "2014-12-10T00:00:00-08:00", "title": "Bootstrap3 Tips CONTINUALLY UPDATE", "url": "/posts/2015/Front%20End/bootstrap3-tricks.html"}, {"date": "12/10/2014", "isodate": "2014-12-10T00:00:00-08:00", "title": "Bootstrap3 API Reading Notes", "url": "/posts/2014/bootstrap3-api-reading-notes.html"}]}], "Business": [4, "/categories/business.html", {"posts": [{"date": "05/30/2017", "isodate": "2017-05-30T00:00:00-07:00", "title": "(In Chinese) \u7a77\u67e5\u7406\u5b9d\u5178-\u9605\u8bfb\u6458\u62843\uff08\u8d22\u62a5\uff09", "url": "/posts/2017/book/chinese-poor-charlies-almanack-3.html"}, {"date": "05/21/2017", "isodate": "2017-05-21T00:00:00-07:00", "title": "(In Chinese) \u7a77\u67e5\u7406\u5b9d\u5178-\u9605\u8bfb\u6458\u62841 \uff08\u4f01\u4e1a\u4e0e\u6295\u8d44\uff09", "url": "/posts/2017/book/chinese-poor-charlies-almanack-1.html"}, {"date": "05/21/2017", "isodate": "2017-05-21T00:00:00-07:00", "title": "(In Chinese) \u7a77\u67e5\u7406\u5b9d\u5178-\u9605\u8bfb\u6458\u62842 \uff08\u4e2a\u4eba\u53d1\u5c55\uff09", "url": "/posts/2017/book/chinese-poor-charlies-almanack-2.html"}, {"date": "02/20/2017", "isodate": "2017-02-20T00:00:00-08:00", "title": "(In Chinese) \u5bcc\u7238\u7238\u7a77\u7238\u7238-\u9605\u8bfb\u6458\u6284", "url": "/posts/2017/book/chinese-rich-data-poor-dad.html"}]}], "CDN": [1, "/categories/cdn.html", {"posts": [{"date": "01/13/2015", "isodate": "2015-01-13T00:00:00-08:00", "title": "The Benefit of Hosting Content Library with CDN", "url": "/posts/2014/benefit-of-hosting-content-library-with-CDN.html"}]}], "CSS": [5, "/categories/css.html", {"posts": [{"date": "01/20/2016", "isodate": "2016-01-20T00:00:00-08:00", "title": "LESS Tutorials Notes", "url": "/posts/2016/Front%20End/less_tutorials_notes.html"}, {"date": "07/09/2015", "isodate": "2015-07-09T00:00:00-07:00", "title": "Bootstrap 3 Sticky Footer by Martin Bean and Ryan Fait", "url": "/posts/2015/Front%20End/bootstrap3_sticky_footer.html"}, {"date": "06/04/2015", "isodate": "2015-06-04T00:00:00-07:00", "title": "Collection of Tips for Creating/Controlling Dropdown on Web Page", "url": "/posts/2015/JavaScript/create-controll-dropdown.html"}, {"date": "01/13/2015", "isodate": "2015-01-13T00:00:00-08:00", "title": "SASS Q&A and Tips CONTINUALLY UPDATE", "url": "/posts/2015/Front%20End/sass-qa-and-tips.html"}, {"date": "12/10/2014", "isodate": "2014-12-10T00:00:00-08:00", "title": "Bootstrap3 Tips CONTINUALLY UPDATE", "url": "/posts/2015/Front%20End/bootstrap3-tricks.html"}, {"date": "12/10/2014", "isodate": "2014-12-10T00:00:00-08:00", "title": "Bootstrap3 API Reading Notes", "url": "/posts/2014/bootstrap3-api-reading-notes.html"}]}], "CSS3": [2, "/categories/css3.html", {"posts": [{"date": "07/27/2016", "isodate": "2016-07-27T00:00:00-07:00", "title": "Quick Note about Box-Sizing/Box-Shadow", "url": "/posts/2016/Front%20End/quick-note-about-box-box-shadow.html"}, {"date": "07/18/2016", "isodate": "2016-07-18T00:00:00-07:00", "title": "Learning Note - CSS Transitions and Transforms (Lynda.com)", "url": "/posts/2016/Front%20End/learning-note-css-transitions-and-transforms.html"}]}], "Chinese": [11, "/categories/chinese.html", {"posts": [{"date": "03/18/2018", "isodate": "2018-03-18T00:00:00-07:00", "title": "(Chinese) Highlights for \u201cThe Minto Pyramid Principle: Logic in Writing, Thinking, & Problem Solving/\u91d1\u5b57\u5854\u539f\u7406\u201d by Barbara Minto", "url": "/posts/2018/book/hightlights-for-the-minto-pyramid-principle.html"}, {"date": "01/31/2018", "isodate": "2018-01-31T00:00:00-08:00", "title": "(In Chinese) \u6392\u5217\u7ec4\u5408\u7b80\u5355\u7b14\u8bb0/A hand-writing brief note about permutation and combination", "url": "/posts/2018/math/chinese-permutation-combination-brief-note.html"}, {"date": "01/18/2018", "isodate": "2018-01-18T00:00:00-08:00", "title": "(In Chinese) \u5c0f\u72d7\u94b1\u94b1\u9605\u8bfb\u6458\u6284| Highlight of 'Money Oder Das 1 X 1 Des Geldes' by Bodo Shafer", "url": "/posts/2018/book/highlight-of-money-oder-das-1-X-1-des-geldes-by-bodo-shafer.html"}, {"date": "10/08/2017", "isodate": "2017-10-08T00:00:00-07:00", "title": "(Chinese) Kindle Highlights for \u8aad\u66f8\u306f1\u518a\u306e\u30ce\u30fc\u30c8\u306b\u307e\u3068\u3081\u306a\u3055\u3044 (How to read a book effectively) by \u5965\u91ce\u5ba3\u4e4b", "url": "/posts/2017/book/kindle-hightlights-for-how-to-read-a-book-effectively.html"}, {"date": "06/25/2017", "isodate": "2017-06-25T00:00:00-07:00", "title": "(In Chinese) \u98ce\u683c\u7684\u8981\u7d20-\u9605\u8bfb\u6458\u6284 (The Elements of Style - Reading Note)", "url": "/posts/2017/book/chinese-the-element-of-style-reading-note.html"}, {"date": "05/30/2017", "isodate": "2017-05-30T00:00:00-07:00", "title": "(In Chinese) \u7a77\u67e5\u7406\u5b9d\u5178-\u9605\u8bfb\u6458\u62843\uff08\u8d22\u62a5\uff09", "url": "/posts/2017/book/chinese-poor-charlies-almanack-3.html"}, {"date": "05/21/2017", "isodate": "2017-05-21T00:00:00-07:00", "title": "(In Chinese) \u7a77\u67e5\u7406\u5b9d\u5178-\u9605\u8bfb\u6458\u62841 \uff08\u4f01\u4e1a\u4e0e\u6295\u8d44\uff09", "url": "/posts/2017/book/chinese-poor-charlies-almanack-1.html"}, {"date": "05/21/2017", "isodate": "2017-05-21T00:00:00-07:00", "title": "(In Chinese) \u7a77\u67e5\u7406\u5b9d\u5178-\u9605\u8bfb\u6458\u62842 \uff08\u4e2a\u4eba\u53d1\u5c55\uff09", "url": "/posts/2017/book/chinese-poor-charlies-almanack-2.html"}, {"date": "03/26/2017", "isodate": "2017-03-26T00:00:00-07:00", "title": "(In Chinese) \u9ea6\u80af\u9521\u6559\u6211\u7684\u5199\u4f5c\u6b66\u5668-\u4ece\u903b\u8f91\u601d\u8003\u5230\u6587\u6848\u5199\u4f5c-\u9605\u8bfb\u6458\u6284", "url": "/posts/2017/book/chinese-mckindsay-notetaking.html"}, {"date": "03/26/2017", "isodate": "2017-03-26T00:00:00-07:00", "title": "(In Chinese) \u6210\u529f\u4eba\u58eb\u7684\u4e03\u4e2a\u4e60\u60ef-\u9605\u8bfb\u6458\u6284", "url": "/posts/2017/book/chinese-habits-of-highly-effective-people.html"}, {"date": "03/14/2017", "isodate": "2017-03-14T00:00:00-07:00", "title": "(In Chinese) \u6279\u5224\u6027\u601d\u7ef4-\u5e26\u4f60\u8d70\u51fa\u601d\u7ef4\u7684\u8bef\u533a-\u9605\u8bfb\u6458\u6284", "url": "/posts/2017/book/chinese-critical-thinking.html"}, {"date": "02/20/2017", "isodate": "2017-02-20T00:00:00-08:00", "title": "(In Chinese) \u5bcc\u7238\u7238\u7a77\u7238\u7238-\u9605\u8bfb\u6458\u6284", "url": "/posts/2017/book/chinese-rich-data-poor-dad.html"}, {"date": "02/08/2017", "isodate": "2017-02-08T00:00:00-08:00", "title": "(In Chinese) \u806a\u660e\u4eba\u7528\u65b9\u683c\u7b14\u8bb0\u672c-\u9605\u8bfb\u6458\u6284", "url": "/posts/2017/book/chinese-use-graph-ruled-notebook.html"}, {"date": "01/20/2017", "isodate": "2017-01-20T00:00:00-08:00", "title": "(In Chinese) \u81ea\u63a7\u529b\u9605\u8bfb\u6458\u6284 (Kindle \u5bfc\u51fa)", "url": "/posts/2017/book/chinese-zi-kong-li-highlight.html"}]}], "Clean Data": [1, "/categories/clean-data.html", {"posts": [{"date": "04/24/2017", "isodate": "2017-04-24T00:00:00-07:00", "title": "Meeting Notes for 'From Dirty to Decisive: Using Clean Data to Your Advantage'", "url": "/posts/2017/data%20science/meeting-notes-for-from-dirty-to-decisive-using-clean-data-to-your-advantage.html"}]}], "Compass": [1, "/categories/compass.html", {"posts": [{"date": "01/13/2015", "isodate": "2015-01-13T00:00:00-08:00", "title": "SASS Q&A and Tips CONTINUALLY UPDATE", "url": "/posts/2015/Front%20End/sass-qa-and-tips.html"}]}], "D3.js": [8, "/categories/d3js.html", {"posts": [{"date": "12/10/2014", "isodate": "2014-12-10T00:00:00-08:00", "title": "Reading Notes for D3.js Part V (Chapter 9)", "url": "/posts/2014/reading-d3-9.html"}, {"date": "12/10/2014", "isodate": "2014-12-10T00:00:00-08:00", "title": "Reading Notes for D3.js Part IV (Chapter 8)", "url": "/posts/2014/reading-d3-8.html"}, {"date": "12/10/2014", "isodate": "2014-12-10T00:00:00-08:00", "title": "Reading Notes for D3.js Part III (Chapter 7)", "url": "/posts/2014/reading-d3-7.html"}, {"date": "12/10/2014", "isodate": "2014-12-10T00:00:00-08:00", "title": "Reading Notes for D3.js Part II (Chapter 6)", "url": "/posts/2014/reading-d3-6.html"}, {"date": "12/10/2014", "isodate": "2014-12-10T00:00:00-08:00", "title": "Reading Notes for D3.js Part VIII (Chapter 12)", "url": "/posts/2014/reading-d3-12.html"}, {"date": "12/10/2014", "isodate": "2014-12-10T00:00:00-08:00", "title": "Reading Notes for D3.js Part VII (Chapter 11)", "url": "/posts/2014/reading-d3-11.html"}, {"date": "12/10/2014", "isodate": "2014-12-10T00:00:00-08:00", "title": "Reading Notes for D3.js Part VI (Chapter 10)", "url": "/posts/2014/reading-d3-10.html"}, {"date": "12/10/2014", "isodate": "2014-12-10T00:00:00-08:00", "title": "Reading Notes for D3.js Part I (Chapter 1 to Chapter 5)", "url": "/posts/2014/reading-d3-1-to-5.html"}]}], "Data": [1, "/categories/data.html", {"posts": [{"date": "07/21/2015", "isodate": "2015-07-21T00:00:00-07:00", "title": "RDF Basics", "url": "/posts/2015/Others/rdf-basics.html"}]}], "Data Science": [3, "/categories/data-science.html", {"posts": [{"date": "08/10/2015", "isodate": "2015-08-10T00:00:00-07:00", "title": "SparkSQL Basics", "url": "/posts/2015/Data%20Science/sparksql-basics.html"}, {"date": "07/21/2015", "isodate": "2015-07-21T00:00:00-07:00", "title": "Search Engine Basics (Including Lucene)", "url": "/posts/2015/Data%20Science/search-engine-basics-lucene.html"}, {"date": "06/10/2015", "isodate": "2015-06-10T00:00:00-07:00", "title": "Install Apache Spark with IPython Notebook Configuration on Ubuntu 15", "url": "/posts/2015/Data%20Science/ipython-notebook-pyspark.html"}]}], "Data Structure": [5, "/categories/data-structure.html", {"posts": [{"date": "09/11/2015", "isodate": "2015-09-11T00:00:00-07:00", "title": "Algorithm and Data Structure Basics - Sorting", "url": "/posts/2015/Algorithm%20Data%20Structure/algorithm-and-data-structure-basics-sorting.html"}, {"date": "09/03/2015", "isodate": "2015-09-03T00:00:00-07:00", "title": "Algorithm and Data Structure Basics - Heap", "url": "/posts/2015/Algorithm%20Data%20Structure/algorithm-and-data-structure-basics-heap.html"}, {"date": "09/02/2015", "isodate": "2015-09-02T00:00:00-07:00", "title": "Algorithm and Data Structure Basics - Recursion", "url": "/posts/2015/Algorithm%20Data%20Structure/algorithm-and-data-structure-basics-recursion.html"}, {"date": "09/02/2015", "isodate": "2015-09-02T00:00:00-07:00", "title": "Algorithm and Data Structure Basics - Linked List", "url": "/posts/2015/Algorithm%20Data%20Structure/algorithm-and-data-structure-basics-linkedlist.html"}, {"date": "09/01/2015", "isodate": "2015-09-01T00:00:00-07:00", "title": "Algorithm and Data Structure Basics - Dynamic Programming", "url": "/posts/2015/Algorithm%20Data%20Structure/algorithm-and-data-structure-basics-dynamic-programming.html"}]}], "Data Visualization": [1, "/categories/data-visualization.html", {"posts": [{"date": "04/24/2017", "isodate": "2017-04-24T00:00:00-07:00", "title": "Meeting Notes for 'From Dirty to Decisive: Using Clean Data to Your Advantage'", "url": "/posts/2017/data%20science/meeting-notes-for-from-dirty-to-decisive-using-clean-data-to-your-advantage.html"}]}], "Database": [2, "/categories/database.html", {"posts": [{"date": "07/30/2015", "isodate": "2015-07-30T00:00:00-07:00", "title": "SQL Tips", "url": "/posts/2015/Data%20Science/sql-tips.html"}, {"date": "06/21/2015", "isodate": "2015-06-21T00:00:00-07:00", "title": "SQL Basics", "url": "/posts/2015/Data%20Science/sql-basics.html"}]}], "Digial Library": [1, "/categories/digial-library.html", {"posts": [{"date": "08/09/2015", "isodate": "2015-08-09T00:00:00-07:00", "title": "Dive into Hydra and My Thoughts", "url": "/posts/2015/Others/dive-into-hydra-and-my-thoughts.html"}]}], "Digital Library": [1, "/categories/digital-library.html", {"posts": [{"date": "07/21/2015", "isodate": "2015-07-21T00:00:00-07:00", "title": "RDF Basics", "url": "/posts/2015/Others/rdf-basics.html"}]}], "Dropdown": [1, "/categories/dropdown.html", {"posts": [{"date": "06/04/2015", "isodate": "2015-06-04T00:00:00-07:00", "title": "Collection of Tips for Creating/Controlling Dropdown on Web Page", "url": "/posts/2015/JavaScript/create-controll-dropdown.html"}]}], "Dynamic Programming": [1, "/categories/dynamic-programming.html", {"posts": [{"date": "09/01/2015", "isodate": "2015-09-01T00:00:00-07:00", "title": "Algorithm and Data Structure Basics - Dynamic Programming", "url": "/posts/2015/Algorithm%20Data%20Structure/algorithm-and-data-structure-basics-dynamic-programming.html"}]}], "English": [1, "/categories/english.html", {"posts": [{"date": "06/25/2017", "isodate": "2017-06-25T00:00:00-07:00", "title": "(In Chinese) \u98ce\u683c\u7684\u8981\u7d20-\u9605\u8bfb\u6458\u6284 (The Elements of Style - Reading Note)", "url": "/posts/2017/book/chinese-the-element-of-style-reading-note.html"}]}], "Fedora": [1, "/categories/fedora.html", {"posts": [{"date": "08/12/2015", "isodate": "2015-08-12T00:00:00-07:00", "title": "A Journal of Playing with Hydra Data", "url": "/posts/2015/Others/play-with-hydra-data.html"}]}], "Finance": [5, "/categories/finance.html", {"posts": [{"date": "01/18/2018", "isodate": "2018-01-18T00:00:00-08:00", "title": "(In Chinese) \u5c0f\u72d7\u94b1\u94b1\u9605\u8bfb\u6458\u6284| Highlight of 'Money Oder Das 1 X 1 Des Geldes' by Bodo Shafer", "url": "/posts/2018/book/highlight-of-money-oder-das-1-X-1-des-geldes-by-bodo-shafer.html"}, {"date": "05/30/2017", "isodate": "2017-05-30T00:00:00-07:00", "title": "(In Chinese) \u7a77\u67e5\u7406\u5b9d\u5178-\u9605\u8bfb\u6458\u62843\uff08\u8d22\u62a5\uff09", "url": "/posts/2017/book/chinese-poor-charlies-almanack-3.html"}, {"date": "05/21/2017", "isodate": "2017-05-21T00:00:00-07:00", "title": "(In Chinese) \u7a77\u67e5\u7406\u5b9d\u5178-\u9605\u8bfb\u6458\u62841 \uff08\u4f01\u4e1a\u4e0e\u6295\u8d44\uff09", "url": "/posts/2017/book/chinese-poor-charlies-almanack-1.html"}, {"date": "05/21/2017", "isodate": "2017-05-21T00:00:00-07:00", "title": "(In Chinese) \u7a77\u67e5\u7406\u5b9d\u5178-\u9605\u8bfb\u6458\u62842 \uff08\u4e2a\u4eba\u53d1\u5c55\uff09", "url": "/posts/2017/book/chinese-poor-charlies-almanack-2.html"}, {"date": "02/20/2017", "isodate": "2017-02-20T00:00:00-08:00", "title": "(In Chinese) \u5bcc\u7238\u7238\u7a77\u7238\u7238-\u9605\u8bfb\u6458\u6284", "url": "/posts/2017/book/chinese-rich-data-poor-dad.html"}]}], "Github": [1, "/categories/github.html", {"posts": [{"date": "01/13/2015", "isodate": "2015-01-13T00:00:00-08:00", "title": "How to Build A Basic Nikola Blog and Deploy to Github Page", "url": "/posts/2015/Data%20Science/how-to-build-a-basic-nikola-blog-and-deloy-to-github-page.html"}]}], "Google": [1, "/categories/google.html", {"posts": [{"date": "12/10/2014", "isodate": "2014-12-10T00:00:00-08:00", "title": "Use Google Custom Search In Your Website", "url": "/posts/2014/use-google-custom-search-in-your-website.html"}]}], "Graph": [1, "/categories/graph.html", {"posts": [{"date": "08/01/2016", "isodate": "2016-08-01T00:00:00-07:00", "title": "SVG Study Note", "url": "/posts/2016/Front%20End/svg-study-note.html"}]}], "HTML5": [4, "/categories/html5.html", {"posts": [{"date": "08/16/2016", "isodate": "2016-08-16T00:00:00-07:00", "title": "Frond End Data Storage", "url": "/posts/2016/Front%20End/front-end-data-storage.html"}, {"date": "07/09/2015", "isodate": "2015-07-09T00:00:00-07:00", "title": "Bootstrap 3 Sticky Footer by Martin Bean and Ryan Fait", "url": "/posts/2015/Front%20End/bootstrap3_sticky_footer.html"}, {"date": "06/04/2015", "isodate": "2015-06-04T00:00:00-07:00", "title": "Collection of Tips for Creating/Controlling Dropdown on Web Page", "url": "/posts/2015/JavaScript/create-controll-dropdown.html"}, {"date": "01/13/2015", "isodate": "2015-01-13T00:00:00-08:00", "title": "HTML5 Tips", "url": "/posts/2015/Front%20End/html5-tips.html"}]}], "Heap": [1, "/categories/heap.html", {"posts": [{"date": "09/03/2015", "isodate": "2015-09-03T00:00:00-07:00", "title": "Algorithm and Data Structure Basics - Heap", "url": "/posts/2015/Algorithm%20Data%20Structure/algorithm-and-data-structure-basics-heap.html"}]}], "Hydra": [4, "/categories/hydra.html", {"posts": [{"date": "08/12/2015", "isodate": "2015-08-12T00:00:00-07:00", "title": "Setting up RoR/Hydra Environment - Problems and Solutions", "url": "/posts/2015/Web%20Development%20Tips/setting-up-ror-hydra-environment-problems-and-solutions.html"}, {"date": "08/12/2015", "isodate": "2015-08-12T00:00:00-07:00", "title": "A Journal of Playing with Hydra Data", "url": "/posts/2015/Others/play-with-hydra-data.html"}, {"date": "08/09/2015", "isodate": "2015-08-09T00:00:00-07:00", "title": "Dive into Hydra and My Thoughts", "url": "/posts/2015/Others/dive-into-hydra-and-my-thoughts.html"}, {"date": "07/21/2015", "isodate": "2015-07-21T00:00:00-07:00", "title": "Search Engine Basics (Including Lucene)", "url": "/posts/2015/Data%20Science/search-engine-basics-lucene.html"}]}], "IPython": [1, "/categories/ipython.html", {"posts": [{"date": "06/10/2015", "isodate": "2015-06-10T00:00:00-07:00", "title": "Install Apache Spark with IPython Notebook Configuration on Ubuntu 15", "url": "/posts/2015/Data%20Science/ipython-notebook-pyspark.html"}]}], "JSON": [1, "/categories/json.html", {"posts": [{"date": "08/13/2015", "isodate": "2015-08-13T00:00:00-07:00", "title": "Possible Ajax Error Code and Reasons", "url": "/posts/2015/JavaScript/possible-ajax-error-code-and-reasons.html"}]}], "JUnit": [1, "/categories/junit.html", {"posts": [{"date": "07/24/2015", "isodate": "2015-07-24T00:00:00-07:00", "title": "JUnit Basics", "url": "/posts/2015/Java/junit-basics.html"}]}], "Jasmine": [1, "/categories/jasmine.html", {"posts": [{"date": "08/25/2015", "isodate": "2015-08-25T00:00:00-07:00", "title": "Jasmine Basics", "url": "/posts/2015/JavaScript/jasmine-basics.html"}]}], "Java": [33, "/categories/java.html", {"posts": [{"date": "11/11/2015", "isodate": "2015-11-11T00:00:00-08:00", "title": "Apache Velocity Language Basics", "url": "/posts/2015/Java/apache-velocity-basics.html"}, {"date": "09/11/2015", "isodate": "2015-09-11T00:00:00-07:00", "title": "Algorithm and Data Structure Basics - Sorting", "url": "/posts/2015/Algorithm%20Data%20Structure/algorithm-and-data-structure-basics-sorting.html"}, {"date": "09/03/2015", "isodate": "2015-09-03T00:00:00-07:00", "title": "Algorithm and Data Structure Basics - Heap", "url": "/posts/2015/Algorithm%20Data%20Structure/algorithm-and-data-structure-basics-heap.html"}, {"date": "09/02/2015", "isodate": "2015-09-02T00:00:00-07:00", "title": "Algorithm and Data Structure Basics - Recursion", "url": "/posts/2015/Algorithm%20Data%20Structure/algorithm-and-data-structure-basics-recursion.html"}, {"date": "09/02/2015", "isodate": "2015-09-02T00:00:00-07:00", "title": "Algorithm and Data Structure Basics - Linked List", "url": "/posts/2015/Algorithm%20Data%20Structure/algorithm-and-data-structure-basics-linkedlist.html"}, {"date": "09/01/2015", "isodate": "2015-09-01T00:00:00-07:00", "title": "Algorithm and Data Structure Basics - Dynamic Programming", "url": "/posts/2015/Algorithm%20Data%20Structure/algorithm-and-data-structure-basics-dynamic-programming.html"}, {"date": "08/13/2015", "isodate": "2015-08-13T00:00:00-07:00", "title": "Possible Ajax Error Code and Reasons", "url": "/posts/2015/JavaScript/possible-ajax-error-code-and-reasons.html"}, {"date": "08/05/2015", "isodate": "2015-08-05T00:00:00-07:00", "title": "RequestDispacher and Redirection in Java Web App", "url": "/posts/2015/Java/requestdispacher-redirection-in-java.html"}, {"date": "08/03/2015", "isodate": "2015-08-03T00:00:00-07:00", "title": "Ajax and Java Servlet", "url": "/posts/2015/Java/ajax-and-java-servlet.html"}, {"date": "07/24/2015", "isodate": "2015-07-24T00:00:00-07:00", "title": "JUnit Basics", "url": "/posts/2015/Java/junit-basics.html"}, {"date": "06/16/2015", "isodate": "2015-06-16T00:00:00-07:00", "title": "Spring Tips", "url": "/posts/2015/Java/spring-tips.html"}, {"date": "01/13/2015", "isodate": "2015-01-13T00:00:00-08:00", "title": "Manning OCP Java SE 7 Reading Note: Chapter 1", "url": "/posts/2015/Java/manning-ocp-java-se7-reading-note-chapter-1.html"}, {"date": "01/13/2015", "isodate": "2015-01-13T00:00:00-08:00", "title": "Manning OCA Java SE 7 Reading Note: Chapter 7", "url": "/posts/2015/Java/manning-oca-java-se7-reading-note-chapter-7.html"}, {"date": "01/13/2015", "isodate": "2015-01-13T00:00:00-08:00", "title": "Manning OCA Java SE 7 Reading Note: Chapter 6", "url": "/posts/2015/Java/manning-oca-java-se7-reading-note-chapter-6.html"}, {"date": "01/13/2015", "isodate": "2015-01-13T00:00:00-08:00", "title": "Manning OCA Java SE 7 Reading Note: Chapter 5", "url": "/posts/2015/Java/manning-oca-java-se7-reading-note-chapter-5.html"}, {"date": "01/13/2015", "isodate": "2015-01-13T00:00:00-08:00", "title": "Manning OCA Java SE 7 Reading Note: Chapter 4", "url": "/posts/2015/Java/manning-oca-java-se7-reading-note-chapter-4.html"}, {"date": "01/13/2015", "isodate": "2015-01-13T00:00:00-08:00", "title": "Manning OCA Java SE 7 Reading Note: Chapter 3", "url": "/posts/2015/Java/manning-oca-java-se7-reading-note-chapter-3.html"}, {"date": "01/13/2015", "isodate": "2015-01-13T00:00:00-08:00", "title": "Manning OCA Java SE 7 Reading Note: Chapter 2", "url": "/posts/2015/Java/manning-oca-java-se7-reading-note-chapter-2.html"}, {"date": "01/13/2015", "isodate": "2015-01-13T00:00:00-08:00", "title": "Manning OCA Java SE 7 Reading Note: Chapter 1", "url": "/posts/2015/Java/manning-oca-java-se7-reading-note-chapter-1.html"}, {"date": "01/13/2015", "isodate": "2015-01-13T00:00:00-08:00", "title": "Important Q&A for OCA Java SE7 Certification Guide", "url": "/posts/2015/Java/key-qas-for-oca-book.html"}, {"date": "01/13/2015", "isodate": "2015-01-13T00:00:00-08:00", "title": "JSTL Reference Sheet", "url": "/posts/2015/Java/jstl-reference-sheet.html"}, {"date": "01/13/2015", "isodate": "2015-01-13T00:00:00-08:00", "title": "Java Knowledge: HashCode", "url": "/posts/2015/Java/java-knowledge-hashcode.html"}, {"date": "01/13/2015", "isodate": "2015-01-13T00:00:00-08:00", "title": "Java Knowledge: Enum", "url": "/posts/2015/Java/java-knowledge-enum.html"}, {"date": "01/13/2015", "isodate": "2015-01-13T00:00:00-08:00", "title": "Ajax and Spring MVC Controller", "url": "/posts/2015/Java/ajax-and-spring-mvc-controller.html"}, {"date": "01/13/2015", "isodate": "2015-01-13T00:00:00-08:00", "title": "Reading Note for Andorid Development Guide Part I", "url": "/posts/2014/reading-note-android-I.html"}, {"date": "12/10/2014", "isodate": "2014-12-10T00:00:00-08:00", "title": "Use Java to Get Client's IP Address", "url": "/posts/2014/use-java-to-get-clients-ip-address.html"}, {"date": "12/10/2014", "isodate": "2014-12-10T00:00:00-08:00", "title": "Reading Notes for Spring 3 Core Components Tutorial Part VI (Chapter 22)", "url": "/posts/2014/reading-spring-3-22.html"}, {"date": "12/10/2014", "isodate": "2014-12-10T00:00:00-08:00", "title": "Reading Notes for Spring 3 Core Components Tutorial Part VII (Chapter 21)", "url": "/posts/2014/reading-spring-3-21.html"}, {"date": "12/10/2014", "isodate": "2014-12-10T00:00:00-08:00", "title": "Reading Notes for Spring 3 Core Components Tutorial Part V (Chapter 20)", "url": "/posts/2014/reading-spring-3-20.html"}, {"date": "12/10/2014", "isodate": "2014-12-10T00:00:00-08:00", "title": "Reading Notes for Spring 3 Core Components Tutorial Part I Part IV (Chapter 17 to Chapter 19)", "url": "/posts/2014/reading-spring-3-17-to-19.html"}, {"date": "12/10/2014", "isodate": "2014-12-10T00:00:00-08:00", "title": "Reading Notes for Spring 3 Core Components Tutorial Part Part III (Chapter 14 to Chapter 16)", "url": "/posts/2014/reading-spring-3-14-to-16.html"}, {"date": "12/10/2014", "isodate": "2014-12-10T00:00:00-08:00", "title": "Reading Notes for Spring 3 Core Components Tutorial Part II (Chapter 11 to Chapter 13)", "url": "/posts/2014/reading-spring-3-11-to-13.html"}, {"date": "12/10/2014", "isodate": "2014-12-10T00:00:00-08:00", "title": "Reading Notes for Spring 3 Core Components Tutorial Part I (Chapter 1 to Chapter 10)", "url": "/posts/2014/reading-spring-3-1-to-10.html"}]}], "JavaScript": [27, "/categories/javascript.html", {"posts": [{"date": "12/16/2016", "isodate": "2016-12-16T00:00:00-08:00", "title": "A Brief Introduction of JWT (JavaScript Web Token)", "url": "/posts/2016/JavaScript/a-brief-introduction-of-jwt.html"}, {"date": "08/16/2016", "isodate": "2016-08-16T00:00:00-07:00", "title": "Frond End Data Storage", "url": "/posts/2016/Front%20End/front-end-data-storage.html"}, {"date": "06/22/2016", "isodate": "2016-06-22T00:00:00-07:00", "title": "Reading Note - JavaScript Scoping, Hoisting and Others", "url": "/posts/2016/JavaScript/reading-note-javascript-scoping-hoisting-and-others.html"}, {"date": "05/17/2016", "isodate": "2016-05-17T00:00:00-07:00", "title": "Reading Note - Asynchronous in jQuery and ECMAScript 6", "url": "/posts/2016/JavaScript/reading_note_defer_in_jquery.html"}, {"date": "09/22/2015", "isodate": "2015-09-22T00:00:00-07:00", "title": "Number Precision in JavaScript", "url": "/posts/2015/JavaScript/number-precision-in-javascript.html"}, {"date": "08/25/2015", "isodate": "2015-08-25T00:00:00-07:00", "title": "Jasmine Basics", "url": "/posts/2015/JavaScript/jasmine-basics.html"}, {"date": "08/20/2015", "isodate": "2015-08-20T00:00:00-07:00", "title": "Regular Expression", "url": "/posts/2015/Web%20Development%20Tips/regular-expression.html"}, {"date": "08/17/2015", "isodate": "2015-08-17T00:00:00-07:00", "title": "JavaScript Tips", "url": "/posts/2015/JavaScript/javascript-tips.html"}, {"date": "08/11/2015", "isodate": "2015-08-11T00:00:00-07:00", "title": "AngularJS Basics", "url": "/posts/2015/JavaScript/angularjs-basics.html"}, {"date": "07/10/2015", "isodate": "2015-07-10T00:00:00-07:00", "title": "JavaScript Object and JSON", "url": "/posts/2015/JavaScript/javascript-object-and-json.html"}, {"date": "07/09/2015", "isodate": "2015-07-09T00:00:00-07:00", "title": "Bootstrap 3 Sticky Footer by Martin Bean and Ryan Fait", "url": "/posts/2015/Front%20End/bootstrap3_sticky_footer.html"}, {"date": "07/02/2015", "isodate": "2015-07-02T00:00:00-07:00", "title": "JavaScript and Color", "url": "/posts/2015/JavaScript/javascript-color.html"}, {"date": "06/04/2015", "isodate": "2015-06-04T00:00:00-07:00", "title": "Collection of Tips for Creating/Controlling Dropdown on Web Page", "url": "/posts/2015/JavaScript/create-controll-dropdown.html"}, {"date": "01/13/2015", "isodate": "2015-01-13T00:00:00-08:00", "title": "Window.Location Property", "url": "/posts/2015/JavaScript/window-location-property.html"}, {"date": "01/13/2015", "isodate": "2015-01-13T00:00:00-08:00", "title": "JavaScript Library Experience: FullCalendar", "url": "/posts/2015/JavaScript/javascript-library-experience-fullcalendar.html"}, {"date": "01/13/2015", "isodate": "2015-01-13T00:00:00-08:00", "title": "Boostrap3 Date Picker", "url": "/posts/2015/JavaScript/bootstrap3-date-picker.html"}, {"date": "01/13/2015", "isodate": "2015-01-13T00:00:00-08:00", "title": "HTML5 Tips", "url": "/posts/2015/Front%20End/html5-tips.html"}, {"date": "12/10/2014", "isodate": "2014-12-10T00:00:00-08:00", "title": "Bootstrap3 Tips CONTINUALLY UPDATE", "url": "/posts/2015/Front%20End/bootstrap3-tricks.html"}, {"date": "12/10/2014", "isodate": "2014-12-10T00:00:00-08:00", "title": "Reading Notes for D3.js Part V (Chapter 9)", "url": "/posts/2014/reading-d3-9.html"}, {"date": "12/10/2014", "isodate": "2014-12-10T00:00:00-08:00", "title": "Reading Notes for D3.js Part IV (Chapter 8)", "url": "/posts/2014/reading-d3-8.html"}, {"date": "12/10/2014", "isodate": "2014-12-10T00:00:00-08:00", "title": "Reading Notes for D3.js Part III (Chapter 7)", "url": "/posts/2014/reading-d3-7.html"}, {"date": "12/10/2014", "isodate": "2014-12-10T00:00:00-08:00", "title": "Reading Notes for D3.js Part II (Chapter 6)", "url": "/posts/2014/reading-d3-6.html"}, {"date": "12/10/2014", "isodate": "2014-12-10T00:00:00-08:00", "title": "Reading Notes for D3.js Part VIII (Chapter 12)", "url": "/posts/2014/reading-d3-12.html"}, {"date": "12/10/2014", "isodate": "2014-12-10T00:00:00-08:00", "title": "Reading Notes for D3.js Part VII (Chapter 11)", "url": "/posts/2014/reading-d3-11.html"}, {"date": "12/10/2014", "isodate": "2014-12-10T00:00:00-08:00", "title": "Reading Notes for D3.js Part VI (Chapter 10)", "url": "/posts/2014/reading-d3-10.html"}, {"date": "12/10/2014", "isodate": "2014-12-10T00:00:00-08:00", "title": "Reading Notes for D3.js Part I (Chapter 1 to Chapter 5)", "url": "/posts/2014/reading-d3-1-to-5.html"}, {"date": "12/10/2014", "isodate": "2014-12-10T00:00:00-08:00", "title": "jQuery Tutorial Reading Notes", "url": "/posts/2014/jquery-tutorial-reading-notes.html"}, {"date": "12/10/2014", "isodate": "2014-12-10T00:00:00-08:00", "title": "Bootstrap3 API Reading Notes", "url": "/posts/2014/bootstrap3-api-reading-notes.html"}]}], "Linked List": [1, "/categories/linked-list.html", {"posts": [{"date": "09/02/2015", "isodate": "2015-09-02T00:00:00-07:00", "title": "Algorithm and Data Structure Basics - Linked List", "url": "/posts/2015/Algorithm%20Data%20Structure/algorithm-and-data-structure-basics-linkedlist.html"}]}], "Linux": [4, "/categories/linux.html", {"posts": [{"date": "08/12/2015", "isodate": "2015-08-12T00:00:00-07:00", "title": "Setting up RoR/Hydra Environment - Problems and Solutions", "url": "/posts/2015/Web%20Development%20Tips/setting-up-ror-hydra-environment-problems-and-solutions.html"}, {"date": "08/01/2015", "isodate": "2015-08-01T00:00:00-07:00", "title": "Ubuntu Tips", "url": "/posts/2015/Linux/ubuntu-tips.html"}, {"date": "01/13/2015", "isodate": "2015-01-13T00:00:00-08:00", "title": "Comparation of Ubuntu14, Linux Mint17 Cinnamon and CentOS7, from a Linux Beginner", "url": "/posts/2014/linux-comparation.html"}, {"date": "01/13/2015", "isodate": "2015-01-13T00:00:00-08:00", "title": "Install Ubuntu 14 on External Drive from Windows8 Machine with Node.js, Hexo and Jekyll", "url": "/posts/2014/install-ubuntu-on-windows-8-machine.html"}]}], "Math": [1, "/categories/math.html", {"posts": [{"date": "01/31/2018", "isodate": "2018-01-31T00:00:00-08:00", "title": "(In Chinese) \u6392\u5217\u7ec4\u5408\u7b80\u5355\u7b14\u8bb0/A hand-writing brief note about permutation and combination", "url": "/posts/2018/math/chinese-permutation-combination-brief-note.html"}]}], "Meeting Notes": [1, "/categories/meeting-notes.html", {"posts": [{"date": "04/24/2017", "isodate": "2017-04-24T00:00:00-07:00", "title": "Meeting Notes for 'From Dirty to Decisive: Using Clean Data to Your Advantage'", "url": "/posts/2017/data%20science/meeting-notes-for-from-dirty-to-decisive-using-clean-data-to-your-advantage.html"}]}], "Nikola": [1, "/categories/nikola.html", {"posts": [{"date": "01/13/2015", "isodate": "2015-01-13T00:00:00-08:00", "title": "How to Build A Basic Nikola Blog and Deploy to Github Page", "url": "/posts/2015/Data%20Science/how-to-build-a-basic-nikola-blog-and-deloy-to-github-page.html"}]}], "Node.js": [1, "/categories/nodejs.html", {"posts": [{"date": "05/25/2016", "isodate": "2016-05-25T00:00:00-07:00", "title": "Node.js Basics", "url": "/posts/2016/JavaScript/node-js-basics.html"}]}], "Note Taking": [3, "/categories/note-taking.html", {"posts": [{"date": "01/31/2018", "isodate": "2018-01-31T00:00:00-08:00", "title": "(In Chinese) \u6392\u5217\u7ec4\u5408\u7b80\u5355\u7b14\u8bb0/A hand-writing brief note about permutation and combination", "url": "/posts/2018/math/chinese-permutation-combination-brief-note.html"}, {"date": "10/08/2017", "isodate": "2017-10-08T00:00:00-07:00", "title": "(Chinese) Kindle Highlights for \u8aad\u66f8\u306f1\u518a\u306e\u30ce\u30fc\u30c8\u306b\u307e\u3068\u3081\u306a\u3055\u3044 (How to read a book effectively) by \u5965\u91ce\u5ba3\u4e4b", "url": "/posts/2017/book/kindle-hightlights-for-how-to-read-a-book-effectively.html"}, {"date": "03/26/2017", "isodate": "2017-03-26T00:00:00-07:00", "title": "(In Chinese) \u9ea6\u80af\u9521\u6559\u6211\u7684\u5199\u4f5c\u6b66\u5668-\u4ece\u903b\u8f91\u601d\u8003\u5230\u6587\u6848\u5199\u4f5c-\u9605\u8bfb\u6458\u6284", "url": "/posts/2017/book/chinese-mckindsay-notetaking.html"}, {"date": "02/08/2017", "isodate": "2017-02-08T00:00:00-08:00", "title": "(In Chinese) \u806a\u660e\u4eba\u7528\u65b9\u683c\u7b14\u8bb0\u672c-\u9605\u8bfb\u6458\u6284", "url": "/posts/2017/book/chinese-use-graph-ruled-notebook.html"}]}], "OOP": [1, "/categories/oop.html", {"posts": [{"date": "06/18/2017", "isodate": "2017-06-18T00:00:00-07:00", "title": "Object Oriented Programming in Professional JavaScript for Web Developers", "url": "/posts/2017/front-end/professional-javascript-oop.html"}]}], "Operating System": [2, "/categories/operating-system.html", {"posts": [{"date": "01/13/2015", "isodate": "2015-01-13T00:00:00-08:00", "title": "Comparation of Ubuntu14, Linux Mint17 Cinnamon and CentOS7, from a Linux Beginner", "url": "/posts/2014/linux-comparation.html"}, {"date": "01/13/2015", "isodate": "2015-01-13T00:00:00-08:00", "title": "Install Ubuntu 14 on External Drive from Windows8 Machine with Node.js, Hexo and Jekyll", "url": "/posts/2014/install-ubuntu-on-windows-8-machine.html"}]}], "Python": [3, "/categories/python.html", {"posts": [{"date": "06/10/2015", "isodate": "2015-06-10T00:00:00-07:00", "title": "Install Apache Spark with IPython Notebook Configuration on Ubuntu 15", "url": "/posts/2015/Data%20Science/ipython-notebook-pyspark.html"}, {"date": "01/13/2015", "isodate": "2015-01-13T00:00:00-08:00", "title": "Use Amazon EC2 to Host IPython Notebook", "url": "/posts/2015/Data%20Science/use-amazon-ec2-to-host-ipython-notebook.html"}, {"date": "01/13/2015", "isodate": "2015-01-13T00:00:00-08:00", "title": "How to Build A Basic Nikola Blog and Deploy to Github Page", "url": "/posts/2015/Data%20Science/how-to-build-a-basic-nikola-blog-and-deloy-to-github-page.html"}]}], "Reading Notes": [11, "/categories/reading-notes.html", {"posts": [{"date": "03/18/2018", "isodate": "2018-03-18T00:00:00-07:00", "title": "(Chinese) Highlights for \u201cThe Minto Pyramid Principle: Logic in Writing, Thinking, & Problem Solving/\u91d1\u5b57\u5854\u539f\u7406\u201d by Barbara Minto", "url": "/posts/2018/book/hightlights-for-the-minto-pyramid-principle.html"}, {"date": "01/18/2018", "isodate": "2018-01-18T00:00:00-08:00", "title": "(In Chinese) \u5c0f\u72d7\u94b1\u94b1\u9605\u8bfb\u6458\u6284| Highlight of 'Money Oder Das 1 X 1 Des Geldes' by Bodo Shafer", "url": "/posts/2018/book/highlight-of-money-oder-das-1-X-1-des-geldes-by-bodo-shafer.html"}, {"date": "10/08/2017", "isodate": "2017-10-08T00:00:00-07:00", "title": "(Chinese) Kindle Highlights for \u8aad\u66f8\u306f1\u518a\u306e\u30ce\u30fc\u30c8\u306b\u307e\u3068\u3081\u306a\u3055\u3044 (How to read a book effectively) by \u5965\u91ce\u5ba3\u4e4b", "url": "/posts/2017/book/kindle-hightlights-for-how-to-read-a-book-effectively.html"}, {"date": "06/25/2017", "isodate": "2017-06-25T00:00:00-07:00", "title": "(In Chinese) \u98ce\u683c\u7684\u8981\u7d20-\u9605\u8bfb\u6458\u6284 (The Elements of Style - Reading Note)", "url": "/posts/2017/book/chinese-the-element-of-style-reading-note.html"}, {"date": "06/18/2017", "isodate": "2017-06-18T00:00:00-07:00", "title": "Object Oriented Programming in Professional JavaScript for Web Developers", "url": "/posts/2017/front-end/professional-javascript-oop.html"}, {"date": "05/30/2017", "isodate": "2017-05-30T00:00:00-07:00", "title": "(In Chinese) \u7a77\u67e5\u7406\u5b9d\u5178-\u9605\u8bfb\u6458\u62843\uff08\u8d22\u62a5\uff09", "url": "/posts/2017/book/chinese-poor-charlies-almanack-3.html"}, {"date": "05/21/2017", "isodate": "2017-05-21T00:00:00-07:00", "title": "(In Chinese) \u7a77\u67e5\u7406\u5b9d\u5178-\u9605\u8bfb\u6458\u62841 \uff08\u4f01\u4e1a\u4e0e\u6295\u8d44\uff09", "url": "/posts/2017/book/chinese-poor-charlies-almanack-1.html"}, {"date": "05/21/2017", "isodate": "2017-05-21T00:00:00-07:00", "title": "(In Chinese) \u7a77\u67e5\u7406\u5b9d\u5178-\u9605\u8bfb\u6458\u62842 \uff08\u4e2a\u4eba\u53d1\u5c55\uff09", "url": "/posts/2017/book/chinese-poor-charlies-almanack-2.html"}, {"date": "03/31/2017", "isodate": "2017-03-31T00:00:00-07:00", "title": "Slide: Ology Reading Notes", "url": "/posts/2017/book/slide-ology-reading-note.html"}, {"date": "03/26/2017", "isodate": "2017-03-26T00:00:00-07:00", "title": "(In Chinese) \u9ea6\u80af\u9521\u6559\u6211\u7684\u5199\u4f5c\u6b66\u5668-\u4ece\u903b\u8f91\u601d\u8003\u5230\u6587\u6848\u5199\u4f5c-\u9605\u8bfb\u6458\u6284", "url": "/posts/2017/book/chinese-mckindsay-notetaking.html"}, {"date": "03/26/2017", "isodate": "2017-03-26T00:00:00-07:00", "title": "(In Chinese) \u6210\u529f\u4eba\u58eb\u7684\u4e03\u4e2a\u4e60\u60ef-\u9605\u8bfb\u6458\u6284", "url": "/posts/2017/book/chinese-habits-of-highly-effective-people.html"}, {"date": "03/14/2017", "isodate": "2017-03-14T00:00:00-07:00", "title": "(In Chinese) \u6279\u5224\u6027\u601d\u7ef4-\u5e26\u4f60\u8d70\u51fa\u601d\u7ef4\u7684\u8bef\u533a-\u9605\u8bfb\u6458\u6284", "url": "/posts/2017/book/chinese-critical-thinking.html"}, {"date": "02/20/2017", "isodate": "2017-02-20T00:00:00-08:00", "title": "(In Chinese) \u5bcc\u7238\u7238\u7a77\u7238\u7238-\u9605\u8bfb\u6458\u6284", "url": "/posts/2017/book/chinese-rich-data-poor-dad.html"}, {"date": "02/08/2017", "isodate": "2017-02-08T00:00:00-08:00", "title": "(In Chinese) \u806a\u660e\u4eba\u7528\u65b9\u683c\u7b14\u8bb0\u672c-\u9605\u8bfb\u6458\u6284", "url": "/posts/2017/book/chinese-use-graph-ruled-notebook.html"}, {"date": "01/20/2017", "isodate": "2017-01-20T00:00:00-08:00", "title": "(In Chinese) \u81ea\u63a7\u529b\u9605\u8bfb\u6458\u6284 (Kindle \u5bfc\u51fa)", "url": "/posts/2017/book/chinese-zi-kong-li-highlight.html"}]}], "Recursion": [1, "/categories/recursion.html", {"posts": [{"date": "09/02/2015", "isodate": "2015-09-02T00:00:00-07:00", "title": "Algorithm and Data Structure Basics - Recursion", "url": "/posts/2015/Algorithm%20Data%20Structure/algorithm-and-data-structure-basics-recursion.html"}]}], "Research": [1, "/categories/research.html", {"posts": [{"date": "07/21/2015", "isodate": "2015-07-21T00:00:00-07:00", "title": "RDF Basics", "url": "/posts/2015/Others/rdf-basics.html"}]}], "Ruby on Rails": [1, "/categories/ruby-on-rails.html", {"posts": [{"date": "08/12/2015", "isodate": "2015-08-12T00:00:00-07:00", "title": "Setting up RoR/Hydra Environment - Problems and Solutions", "url": "/posts/2015/Web%20Development%20Tips/setting-up-ror-hydra-environment-problems-and-solutions.html"}]}], "SASS": [1, "/categories/sass.html", {"posts": [{"date": "01/13/2015", "isodate": "2015-01-13T00:00:00-08:00", "title": "SASS Q&A and Tips CONTINUALLY UPDATE", "url": "/posts/2015/Front%20End/sass-qa-and-tips.html"}]}], "SEO": [1, "/categories/seo.html", {"posts": [{"date": "07/21/2015", "isodate": "2015-07-21T00:00:00-07:00", "title": "Search Engine Basics (Including Lucene)", "url": "/posts/2015/Data%20Science/search-engine-basics-lucene.html"}]}], "SQL": [2, "/categories/sql.html", {"posts": [{"date": "07/30/2015", "isodate": "2015-07-30T00:00:00-07:00", "title": "SQL Tips", "url": "/posts/2015/Data%20Science/sql-tips.html"}, {"date": "06/21/2015", "isodate": "2015-06-21T00:00:00-07:00", "title": "SQL Basics", "url": "/posts/2015/Data%20Science/sql-basics.html"}]}], "Search Engine": [2, "/categories/search-engine.html", {"posts": [{"date": "07/21/2015", "isodate": "2015-07-21T00:00:00-07:00", "title": "RDF Basics", "url": "/posts/2015/Others/rdf-basics.html"}, {"date": "07/21/2015", "isodate": "2015-07-21T00:00:00-07:00", "title": "Search Engine Basics (Including Lucene)", "url": "/posts/2015/Data%20Science/search-engine-basics-lucene.html"}]}], "Servlet": [2, "/categories/servlet.html", {"posts": [{"date": "08/05/2015", "isodate": "2015-08-05T00:00:00-07:00", "title": "RequestDispacher and Redirection in Java Web App", "url": "/posts/2015/Java/requestdispacher-redirection-in-java.html"}, {"date": "08/03/2015", "isodate": "2015-08-03T00:00:00-07:00", "title": "Ajax and Java Servlet", "url": "/posts/2015/Java/ajax-and-java-servlet.html"}]}], "Software Testing": [2, "/categories/software-testing.html", {"posts": [{"date": "08/25/2015", "isodate": "2015-08-25T00:00:00-07:00", "title": "Jasmine Basics", "url": "/posts/2015/JavaScript/jasmine-basics.html"}, {"date": "07/24/2015", "isodate": "2015-07-24T00:00:00-07:00", "title": "JUnit Basics", "url": "/posts/2015/Java/junit-basics.html"}]}], "Solr": [1, "/categories/solr.html", {"posts": [{"date": "08/12/2015", "isodate": "2015-08-12T00:00:00-07:00", "title": "A Journal of Playing with Hydra Data", "url": "/posts/2015/Others/play-with-hydra-data.html"}]}], "Sorting": [1, "/categories/sorting.html", {"posts": [{"date": "09/11/2015", "isodate": "2015-09-11T00:00:00-07:00", "title": "Algorithm and Data Structure Basics - Sorting", "url": "/posts/2015/Algorithm%20Data%20Structure/algorithm-and-data-structure-basics-sorting.html"}]}], "Spark": [2, "/categories/spark.html", {"posts": [{"date": "08/10/2015", "isodate": "2015-08-10T00:00:00-07:00", "title": "SparkSQL Basics", "url": "/posts/2015/Data%20Science/sparksql-basics.html"}, {"date": "06/10/2015", "isodate": "2015-06-10T00:00:00-07:00", "title": "Install Apache Spark with IPython Notebook Configuration on Ubuntu 15", "url": "/posts/2015/Data%20Science/ipython-notebook-pyspark.html"}]}], "Spring": [2, "/categories/spring.html", {"posts": [{"date": "06/16/2015", "isodate": "2015-06-16T00:00:00-07:00", "title": "Spring Tips", "url": "/posts/2015/Java/spring-tips.html"}, {"date": "01/13/2015", "isodate": "2015-01-13T00:00:00-08:00", "title": "Ajax and Spring MVC Controller", "url": "/posts/2015/Java/ajax-and-spring-mvc-controller.html"}]}], "Spring MVC": [1, "/categories/spring-mvc.html", {"posts": [{"date": "08/13/2015", "isodate": "2015-08-13T00:00:00-07:00", "title": "Possible Ajax Error Code and Reasons", "url": "/posts/2015/JavaScript/possible-ajax-error-code-and-reasons.html"}]}], "TypeScript": [1, "/categories/typescript.html", {"posts": [{"date": "06/21/2016", "isodate": "2016-06-21T00:00:00-07:00", "title": "TypeScript Basics", "url": "/posts/2016/JavaScript/typescript-basics.html"}]}], "Ubuntu": [2, "/categories/ubuntu.html", {"posts": [{"date": "08/12/2015", "isodate": "2015-08-12T00:00:00-07:00", "title": "Setting up RoR/Hydra Environment - Problems and Solutions", "url": "/posts/2015/Web%20Development%20Tips/setting-up-ror-hydra-environment-problems-and-solutions.html"}, {"date": "08/01/2015", "isodate": "2015-08-01T00:00:00-07:00", "title": "Ubuntu Tips", "url": "/posts/2015/Linux/ubuntu-tips.html"}]}], "Velocity": [1, "/categories/velocity.html", {"posts": [{"date": "11/11/2015", "isodate": "2015-11-11T00:00:00-08:00", "title": "Apache Velocity Language Basics", "url": "/posts/2015/Java/apache-velocity-basics.html"}]}], "Web Developement Tips": [1, "/categories/web-developement-tips.html", {"posts": [{"date": "12/10/2014", "isodate": "2014-12-10T00:00:00-08:00", "title": "Use Google Custom Search In Your Website", "url": "/posts/2014/use-google-custom-search-in-your-website.html"}]}], "Web Worker": [1, "/categories/web-worker.html", {"posts": [{"date": "08/17/2016", "isodate": "2016-08-17T00:00:00-07:00", "title": "Web Worker Study Note", "url": "/posts/2016/JavaScript/web-worker-study-note.html"}]}], "Willpower": [1, "/categories/willpower.html", {"posts": [{"date": "01/20/2017", "isodate": "2017-01-20T00:00:00-08:00", "title": "(In Chinese) \u81ea\u63a7\u529b\u9605\u8bfb\u6458\u6284 (Kindle \u5bfc\u51fa)", "url": "/posts/2017/book/chinese-zi-kong-li-highlight.html"}]}], "Writing": [2, "/categories/writing.html", {"posts": [{"date": "03/18/2018", "isodate": "2018-03-18T00:00:00-07:00", "title": "(Chinese) Highlights for \u201cThe Minto Pyramid Principle: Logic in Writing, Thinking, & Problem Solving/\u91d1\u5b57\u5854\u539f\u7406\u201d by Barbara Minto", "url": "/posts/2018/book/hightlights-for-the-minto-pyramid-principle.html"}, {"date": "06/25/2017", "isodate": "2017-06-25T00:00:00-07:00", "title": "(In Chinese) \u98ce\u683c\u7684\u8981\u7d20-\u9605\u8bfb\u6458\u6284 (The Elements of Style - Reading Note)", "url": "/posts/2017/book/chinese-the-element-of-style-reading-note.html"}]}], "jQuery": [13, "/categories/jquery.html", {"posts": [{"date": "05/17/2016", "isodate": "2016-05-17T00:00:00-07:00", "title": "Reading Note - Asynchronous in jQuery and ECMAScript 6", "url": "/posts/2016/JavaScript/reading_note_defer_in_jquery.html"}, {"date": "08/25/2015", "isodate": "2015-08-25T00:00:00-07:00", "title": "Jasmine Basics", "url": "/posts/2015/JavaScript/jasmine-basics.html"}, {"date": "08/17/2015", "isodate": "2015-08-17T00:00:00-07:00", "title": "JavaScript Tips", "url": "/posts/2015/JavaScript/javascript-tips.html"}, {"date": "08/13/2015", "isodate": "2015-08-13T00:00:00-07:00", "title": "Possible Ajax Error Code and Reasons", "url": "/posts/2015/JavaScript/possible-ajax-error-code-and-reasons.html"}, {"date": "08/03/2015", "isodate": "2015-08-03T00:00:00-07:00", "title": "Ajax and Java Servlet", "url": "/posts/2015/Java/ajax-and-java-servlet.html"}, {"date": "07/10/2015", "isodate": "2015-07-10T00:00:00-07:00", "title": "JavaScript Object and JSON", "url": "/posts/2015/JavaScript/javascript-object-and-json.html"}, {"date": "06/04/2015", "isodate": "2015-06-04T00:00:00-07:00", "title": "Collection of Tips for Creating/Controlling Dropdown on Web Page", "url": "/posts/2015/JavaScript/create-controll-dropdown.html"}, {"date": "01/13/2015", "isodate": "2015-01-13T00:00:00-08:00", "title": "JavaScript Library Experience: FullCalendar", "url": "/posts/2015/JavaScript/javascript-library-experience-fullcalendar.html"}, {"date": "01/13/2015", "isodate": "2015-01-13T00:00:00-08:00", "title": "Ajax and Spring MVC Controller", "url": "/posts/2015/Java/ajax-and-spring-mvc-controller.html"}, {"date": "01/13/2015", "isodate": "2015-01-13T00:00:00-08:00", "title": "HTML5 Tips", "url": "/posts/2015/Front%20End/html5-tips.html"}, {"date": "12/10/2014", "isodate": "2014-12-10T00:00:00-08:00", "title": "Bootstrap3 Tips CONTINUALLY UPDATE", "url": "/posts/2015/Front%20End/bootstrap3-tricks.html"}, {"date": "12/10/2014", "isodate": "2014-12-10T00:00:00-08:00", "title": "jQuery Tutorial Reading Notes", "url": "/posts/2014/jquery-tutorial-reading-notes.html"}, {"date": "12/10/2014", "isodate": "2014-12-10T00:00:00-08:00", "title": "Bootstrap3 API Reading Notes", "url": "/posts/2014/bootstrap3-api-reading-notes.html"}]}]}